,title,score,author,genre,Story,Url,id
84,약한영웅,9.83,서패스 / 김진석,"에피소드, 액션","“비겁하다…? 애초에 동등한 시작이 아닌데...
 체급도 쪽수도 안 맞잖아- 이 X끼들아!!”
선천적으로 약한 소년이 상대보다 몇 수 앞을 예측하는 심리전과
지형지물을 이용하고, 도구로 살벌하게 끝장내는 파이터로 성장한다.
이제 그의 또 다른 이름은 '은장백사'다.",https://comic.naver.com/webtoon/list?titleId=710751&weekday=sun,710751
85,합격시켜주세용,9.98,이온,"스토리, 판타지","천년째 용이 되려는 수험생 바리와
전설의 과외선생 찬영이의 낙동강 용 합격 수기",https://comic.naver.com/webtoon/list?titleId=728128&weekday=sun,728128
,에피소드칵테일,9.81,정마루,"스토리, 로맨스",다양함이 모여 탄생하는 칵테일 처럼 개성 강한 남녀가 모여 만들어 가는 청춘 스토리.'에피소드메이비' 정마루 작가 신작!,https://comic.naver.com/webtoon/list?titleId=579352,579352
,프리드로우,9.81,전선욱,"스토리, 드라마","한태성을 중심으로 벌어지는 다양한 청춘들의 스펙타클한 학원 시트콤 드라마
",https://comic.naver.com/webtoon/list?titleId=597447,597447
,평범한 8반,9.80,영파카,"스토리, 드라마",안 평범한 아이들이 모인 평범한 8반고품격 웰메이드 병맛을 느껴보세요,https://comic.naver.com/webtoon/list?titleId=597478,597478
,윈드브레이커,9.84,조용석,"스토리, 스포츠",혼자서 자전거를 즐겨타던 모범생 조자현. 원치 않게 자전거 크루의 일에 자꾸 휘말리게 되는데… 자유를 꿈꾸는 청춘들의 스트릿라이딩 드라마!,https://comic.naver.com/webtoon/list?titleId=602910,602910
,모던패밀리 2,9.68,외눈박이 / 시현,"에피소드, 개그",행복한 가정을 이루기 위해 고군분투하는 어느 수상한 가족 이야기그 두번째 시즌!,https://comic.naver.com/webtoon/list?titleId=617882,617882
,마루한 - 구현동화전,9.89,박성우,"옴니버스, 무협/사극",책을 읽는 것 만으로도 강해지는 마루한그가 읽어가는 무협 동화 이야기,https://comic.naver.com/webtoon/list?titleId=624632,624632
,복학왕,9.06,기안84,"스토리, 드라마",패션왕 우기명이 돌아왔다!즐거운 대학 생활?! 과연?!,https://comic.naver.com/webtoon/list?titleId=626907,626907
,외모지상주의,9.47,박태준,"스토리, 드라마","못생기고 뚱뚱하다고 괴롭힘을 당하며 루저 인생만 살아온 내가 잘생겨졌다는 이유로 인싸가 됐다.

어느 날 자고 일어났더니 갑자기 완벽한 외모와 몸을 지닌 사람이 되어 깨어난다면?",https://comic.naver.com/webtoon/list?titleId=641253,641253
,뷰티풀 군바리,9.81,설이 / 윤상원,"스토리, 드라마",여자도 군대에 간다면?'본격 여자도 군대 가는 만화!,https://comic.naver.com/webtoon/list?titleId=648419,648419
,야부리맨,9.84,미티,"스토리, 개그",말하는대로 모든 것이 이루어진다?! 역대급 슈퍼히어로의 초특급 재능낭비! 미티 작가의 컷툰 신작,https://comic.naver.com/webtoon/list?titleId=651665,651665
,은주의 방 2~3부,9.94,노란구미,"스토리, 드라마","인테리어, 그것은 삶을 바꿔주는 마법이다!
반복되는 야근과 업무 스트레스로 회사를 때려치운 뒤
셀프 인테리어로 인기 블로거가 된 은주.
그녀의 인테리어에서 연애까지, 라이프 체인지 스토리.",https://comic.naver.com/webtoon/list?titleId=654138,654138
,소녀의 세계,9.93,모랑지,"스토리, 드라마","완벽해 보이지만 사실 외로웠던 백조들과 맘씨 착한 오리가 만나
여러 갈등을 함께 겪으며 진짜 친구가 되어가는 소녀들의 찐 우정물",https://comic.naver.com/webtoon/list?titleId=654774,654774
,스피릿 핑거스,9.98,한경찰,"스토리, 로맨스","평범한 여고생, 알록달록 이상한 그림모임에 들어가다!나만의 색을 찾아 떠나는 모험 이야기!",https://comic.naver.com/webtoon/list?titleId=654809,654809
,마법스크롤 상인 지오,9.96,엄재경 / 호패,"스토리, 판타지","마법사인 듯, 마법사 아닌
마법사 같은 너! 오지오!",https://comic.naver.com/webtoon/list?titleId=655746,655746
,닥터 프로스트 시즌 3~4,9.97,이종범,"스토리, 드라마",세상으로부터의 무력감. 엄습하는 두려움. 또다시 덧씌운 분노.끝없는 혐오의 고리로 만들어진 지옥도가 펼쳐진 대한민국.닥터프로스트와 그의 제자 윤성아가 거대한 음모를 막아선다.,https://comic.naver.com/webtoon/list?titleId=655749,655749
,연놈,9.85,상하,"스토리, 드라마","중2 여름, 가지 말라는 말도 좋아했다는 말도 하지 못한 채 보낸 그녀가 3년 만에 나타났다.
지나버린 시간과 마주한 소년 그리고 소녀의 이야기",https://comic.naver.com/webtoon/list?titleId=667573,667573
,203호 저승사자,9.91,샤니,"에피소드, 개그",어느날 저승사자가 찾아왔다.그런데 이 저승사자... 제 정신이 아니다.,https://comic.naver.com/webtoon/list?titleId=670140,670140
,킬더킹,9.67,마사토끼/joana,"스토리, 드라마","왕의 재능이란 무엇일까?
왕좌의 새로운 주인, 진정한 왕에 걸맞는 재능을 가려내는 게임이 시작된다!",https://comic.naver.com/webtoon/list?titleId=670145,670145
,열렙전사,9.92,김세훈,"스토리, 판타지","'퀘스트를 클리어 하는 자, 모든 것을 얻을 것이다'현실 밖의 현실, 루시드 어드벤쳐 최강의 용사 '열렙전사'와 동료들이 벌이는 본격 RPG 어드벤쳐.",https://comic.naver.com/webtoon/list?titleId=670152,670152
,제로게임,9.97,즐바센,"스토리, 판타지","죽음을 선택한 사람들의 인생 재건설 서바이벌!
2015 대학만화 최강자전 수상작",https://comic.naver.com/webtoon/list?titleId=676695,676695
,체크포인트,9.96,송가 / 은소,"스토리, 드라마",내 인생에 세이브 포인트가 있다면?하루에도 수십 번씩 시간을 되돌리는 남자.,https://comic.naver.com/webtoon/list?titleId=677452,677452
,아테나 컴플렉스,9.88,케이사르,"스토리, 판타지",이런 여신님은 처음!어느 여신님의 수천년에 걸친 애절한 짝사랑 이야기,https://comic.naver.com/webtoon/list?titleId=679543,679543
,놓지마 정신줄 시즌2,9.94,신태훈 / 나승훈,"에피소드, 개그","정신, 정주리 남매와 독특한 주변 인물들의정신줄 놓게 만드는 다양한 에피소드들!본격 유체이탈 예방 프로젝트 '놓지마 정신줄'을 이제 컷툰으로 만나보세요",https://comic.naver.com/webtoon/list?titleId=682637,682637
,골든 체인지,9.98,브림스,"스토리, 판타지",세상에서 가장 불운한 소녀 강유와 소녀의 불운을 막아주는 수상한 산신령 우암이 펼치는 판타지세계,https://comic.naver.com/webtoon/list?titleId=685460,685460
,꿈의 기업,9.97,문지현,"스토리, 스릴러",문명을 지배하는 거대기업과 거대기업을 움직이는 인공지능. 그 인공지능이 꿈을 꾸기 시작했다. 엄청난 경쟁률을 뚫고 대기업 드림코퍼레이션에 입사한 꿈사원들. 그들 앞에 의심스러운 일들이 펼쳐지는데..!,https://comic.naver.com/webtoon/list?titleId=687915,687915
,내일,9.98,라마,"옴니버스, 드라마","다 되는데 취업만은 안되는 취준생 최준웅(27세,남)
우연한 사고로 저승독점기업 주마등의 저승차사들을 만나게되고

특별 위기관리팀의 계약직 막내로 일하며 위기에 처한 사람들을 돕게 되는데.",https://comic.naver.com/webtoon/list?titleId=695796,695796